{
  "docSetProductName": "",
  "rootDirectory": "docs/",
  "docLinkSettings": {
    "linkFormat": "relative",
    "relativeLinkPrefix": "/azure/devops/"
  },
  "inclusionCriteria": {
    "minAdditionsToFile": 62
  },
  "areas": [
    {
      "names": [ "artifacts" ],
      "heading": "Artifacts"
    }
  ]
}
